{
  "id": "is_hukuku_001",
  "title": "İşe iade — sözlü fesih ve ödenmemiş maaş",
  "branch": "is_hukuku",
  "difficulty": 1,
  "estimatedMinutes": 8,
  "rubricId": "rubric_v1",
  "summary": "Müvekkil Ayşe Hanım, 7 yıl çalıştığı tekstil fabrikasından sözlü olarak işten çıkarıldı. Yazılı fesih bildirimi yok, son ay maaşı ödenmedi.",
  "facts": [
    "Ayşe Hanım 2018'den beri aynı işverende çalışıyor.",
    "1 hafta önce müdür sözlü olarak 'bugünden itibaren gelmiyorsun' dedi.",
    "Yazılı fesih bildirimi yapılmadı.",
    "Son ay maaşı ödenmedi.",
    "İşveren 30+ işçi çalıştırıyor (iş güvencesi kapsamında)."
  ],
  "documents": [
    { "label": "İş sözleşmesi", "ref": "2018-01-15" },
    { "label": "SGK hizmet dökümü", "ref": "7 yıl, kesintisiz" }
  ],
  "startNode": "n1",
  "nodes": [
    {
      "id": "n1",
      "kind": "decision",
      "prompt": "Müvekkili dinledin. İlk hamlen ne olmalı?",
      "rubricTargets": ["mesele", "usul"],
      "options": [
        {
          "id": "a",
          "label": "Önce işveren feshinin geçerli sebebi olup olmadığını sor; yazılı fesih bildirimi var mı kontrol et.",
          "scores": { "mesele": 3, "usul": 2 },
          "feedback": "Doğru hamle. Geçerli sebep yok + yazılı bildirim yok → fesih usulsüz. İşe iade ve ihbar/kıdem tazminatı gündeme gelir.",
          "next": "n2",
          "verdict": "good"
        },
        {
          "id": "b",
          "label": "Doğrudan arabuluculuğa başvur; fesih sebebini sormaya gerek yok.",
          "scores": { "mesele": 1, "usul": 2 },
          "feedback": "Eksik. Arabuluculuk dava şartı (İş Mahk. K. m. 3) ama olgu tespiti yapılmadan strateji kurulamaz.",
          "next": "n2",
          "verdict": "partial"
        },
        {
          "id": "c",
          "label": "Doğrudan iş mahkemesinde işe iade davası aç.",
          "scores": { "mesele": 1, "usul": 0 },
          "feedback": "Yanlış. Arabuluculuk dava şartıdır (m. 3). Davaya doğrudan gidilirse dava şartı yokluğundan usulden reddedilir.",
          "next": "n2",
          "verdict": "bad",
          "sources": ["is_mahkemeleri_m3"]
        }
      ]
    },
    {
      "id": "n2",
      "kind": "decision",
      "prompt": "Hangi süreye dikkat etmen gerekir?",
      "rubricTargets": ["usul", "risk"],
      "options": [
        {
          "id": "a",
          "label": "Fesih bildirim tarihinden itibaren 1 ay içinde arabulucuya başvur.",
          "scores": { "usul": 4, "risk": 3 },
          "feedback": "Doğru. İş K. m. 20: işe iade için 1 ay içinde arabuluculuk zorunluluğu. Hak düşürücü süredir.",
          "next": "n3",
          "verdict": "good",
          "sources": ["is_kanunu_m20"]
        },
        {
          "id": "b",
          "label": "2 yıllık genel zamanaşımı süresi içinde her zaman başvurulabilir.",
          "scores": { "usul": 0, "risk": 1 },
          "feedback": "Yanlış. İşe iadede süre 1 aydır ve hak düşürücüdür. Kaçırılırsa işe iade hakkı düşer.",
          "next": "n3",
          "verdict": "bad",
          "sources": ["is_kanunu_m20"]
        }
      ]
    },
    {
      "id": "n3",
      "kind": "outcome",
      "prompt": "Strateji özeti hazır.",
      "summary": "Arabuluculuk + işe iade davası + birikmiş maaş alacağı + ihbar/kıdem tazminatı talepleri.",
      "idealAnswer": "1 ay içinde arabulucuya başvur (İş Mahk. K. m. 3 — dava şartı). Anlaşma olmazsa 2 hafta içinde iş mahkemesinde işe iade davası (İş K. m. 20). Davayla birlikte: birikmiş maaş, fazla mesai, yıllık izin, ihbar ve kıdem tazminatı alacaklarını ayrı kalem olarak talep et. Risk: işveren 'haklı sebep' iddia ederse ispat yükü işverende; olgu boşluklarına dikkat."
    }
  ]
}
